title,author,description,date,publisher,language,subjects,categories,isbn,pages,source,identifier,download_count,file_size,pdf_url,cover_url,local_pdf_path,local_cover_path,added_date
"The Times , 1981, UK, English",,,,,en,,,,,archive.org,NewsUK1981UKEnglish,0,11565700,"https://archive.org/download/NewsUK1981UKEnglish/Apr 02 1981, The Times (The Times), #60892, UK (en).pdf",https://archive.org/download/NewsUK1981UKEnglish/__ia_thumb.jpg,,,2025-11-26T03:13:02.940653
The Indian Antiquary Vol-xxxviii(1909),"Education Society’s Press, Byculla Bombay","<p><b>Book Source:</b> <a href=""http://www.new.dli.ernet.in/handle/2015/207419"" rel=""ugc nofollow"">Digital Library of India Item 2015.207419</a></p><p>dc.contributor.other: Temple Richard Carnac Sir<br />dc.date.accessioned: 2015-07-09T15:11:05Z<br />dc.date.available: 2015-07-09T15:11:05Z<br />dc.date.digitalpublicationdate: 2004-01-02<br />dc.date.citation: 1909<br />dc.identifier: Librarian, Rashtrapati Bhavan<br />dc.identifier.barcode: 6010010076501<br />dc.identifier.origpath: /data_copy/upload/0076/506<br />dc.identifier.copyno: 1<br />dc.identifier.uri: http://www.new.dli.ernet.in/handle/2015/207419<br />dc.description.scanningcentre: Rashtrapati Bhavan Library<br />dc.description.main: 1<br />dc.description.tagged: 0<br />dc.description.totalpages: 432<br />dc.format.mimetype: application/pdf<br />dc.language.iso: English<br />dc.publisher.digitalrepublisher: Rashtrapati Bhavan.<br />dc.publisher: Education Society’s Press, Byculla Bombay<br />dc.rights: Out_of_copyright<br />dc.source.library: Rashtrapati Bhavan Library<br />dc.subject.classification: General Encyclopaedias<br />dc.title: The Indian Antiquary Vol-xxxviii(1909)<br /></p>",1909,,en,Rashtrapati,Rashtrapati,,,archive.org,in.ernet.dli.2015.207419,0,42905475,https://archive.org/download/in.ernet.dli.2015.207419/2015.207419.The-Indian.pdf,https://archive.org/download/in.ernet.dli.2015.207419/__ia_thumb.jpg,,,2025-11-26T03:13:03.671139
The Holy Quran with word by word urdu translation  in pdf,Divine Book from God,This archive consist of Holy Quran in arabic along with the word by word translation in urdu. This translation is simple and easy to understand and makes the understanding of the Divine Book more easy.<br />Please download these files and share them to your friends and family to spread the message of Islam to millions of people that can understand urdu or hindi language. Since the best amongst us is the one who learns quran and teach it to others. Also it our religious obligation to spread the message of islam to humanity at large . so if you know a single verse of the Glorious Quran spread it to others.<br />,,,en,"the holy quran in pdf, holy quran with urdu translation in pdf, word by word translation of holy quran in urdu, easy quran in urdu, glorious quran in urdu, para wise quran in urdu pdf","the holy quran in pdf, holy quran with urdu translation in pdf, word by word translation of holy quran in urdu, easy quran in urdu, glorious quran in urdu",,,archive.org,holyquran_wordbyword_urdutranslation_pdf,0,4224779,https://archive.org/download/holyquran_wordbyword_urdutranslation_pdf/para01.pdf,https://archive.org/download/holyquran_wordbyword_urdutranslation_pdf/__ia_thumb.jpg,,,2025-11-26T03:13:04.794502
The Creature From Jekyll Island.pdf (PDFy mirror),,"<p>	<strong>This public document was automatically mirrored from <a href=""https://pdf.yt/"" rel=""nofollow"">PDFy</a>.</strong></p><ul><li><strong>Original filename:</strong> The Creature From Jekyll Island.pdf</li>	<li><strong>URL:</strong> <a href=""http://pdf.yt/d/-Pori1NL6fKm2SnY"" rel=""nofollow"">https://pdf.yt/d/-Pori1NL6fKm2SnY</a></li>	<li><strong>Upload date:</strong> October 07, 2014 03:34:03</li></ul>",2014-01-01,,en,"mirror, pdf.yt","mirror, pdf.yt",,,archive.org,pdfy--Pori1NL6fKm2SnY,0,7079118,https://archive.org/download/pdfy--Pori1NL6fKm2SnY/The Creature From Jekyll Island.pdf,https://archive.org/download/pdfy--Pori1NL6fKm2SnY/__ia_thumb.jpg,,,2025-11-26T03:13:05.687983
The Key of Solomon the king (Clavicula Salomonis),"Solomon, King of Israel. n 80024516","['Limited ed. of 500 numbered copies', 'Includes bibliographic footnotes']",1889,London : George Redway,en,Jewish magic,Jewish magic,,,archive.org,b24884431,0,7303015,https://archive.org/download/b24884431/b24884431.pdf,https://archive.org/download/b24884431/__ia_thumb.jpg,,,2025-11-26T03:13:06.685423
"Why Nations Fail The Origins of Power, Prosperity, and Poverty",,"<b style=""color:rgb(51,51,51);font-family:Arial, sans-serif;font-size:14px;background-color:rgb(255,255,255);"">Brilliant and engagingly written, <i>Why Nations Fail </i>answers the question that has stumped the experts for centuries: Why are some nations rich and others poor, divided by wealth and poverty, health and sickness, food and famine? <br /><i><br /></i></b><span style=""color:rgb(51,51,51);font-family:Arial, sans-serif;font-size:14px;background-color:rgb(255,255,255);"">Is it culture, the weather, geography? Perhaps ignorance of what the right policies are? </span><br style=""color:rgb(51,51,51);font-family:Arial, sans-serif;font-size:14px;background-color:rgb(255,255,255);"" /><br style=""color:rgb(51,51,51);font-family:Arial, sans-serif;font-size:14px;background-color:rgb(255,255,255);"" /><span style=""color:rgb(51,51,51);font-family:Arial, sans-serif;font-size:14px;background-color:rgb(255,255,255);"">Simply, no. None of these factors is either definitive or destiny. Otherwise, how to explain why Botswana has become one of the fastest growing countries in the world, while other African nations, such as Zimbabwe, the Congo, and Sierra Leone, are mired in poverty and violence? </span><br style=""color:rgb(51,51,51);font-family:Arial, sans-serif;font-size:14px;background-color:rgb(255,255,255);"" /><br style=""color:rgb(51,51,51);font-family:Arial, sans-serif;font-size:14px;background-color:rgb(255,255,255);"" /><span style=""color:rgb(51,51,51);font-family:Arial, sans-serif;font-size:14px;background-color:rgb(255,255,255);"">Daron Acemoglu and James Robinson conclusively show that it is man-made political and economic institutions that underlie economic success (or lack of it). Korea, to take just one of their fascinating examples, is a remarkably homogeneous nation, yet the people of North Korea are among the poorest on earth while their brothers and sisters in South Korea are among the richest. The south forged a society that created incentives, rewarded innovation, and allowed everyone to participate in economic opportunities. </span><br style=""color:rgb(51,51,51);font-family:Arial, sans-serif;font-size:14px;background-color:rgb(255,255,255);"" /><br style=""color:rgb(51,51,51);font-family:Arial, sans-serif;font-size:14px;background-color:rgb(255,255,255);"" /><span style=""color:rgb(51,51,51);font-family:Arial, sans-serif;font-size:14px;background-color:rgb(255,255,255);"">The economic success thus spurred was sustained because the government became accountable and responsive to citizens and the great mass of people. Sadly, the people of the north have endured decades of famine, political repression, and very different economic institutions—with no end in sight. The differences between the Koreas is due to the politics that created these completely different institutional trajectories. </span><br style=""color:rgb(51,51,51);font-family:Arial, sans-serif;font-size:14px;background-color:rgb(255,255,255);"" /><br style=""color:rgb(51,51,51);font-family:Arial, sans-serif;font-size:14px;background-color:rgb(255,255,255);"" /><span style=""color:rgb(51,51,51);font-family:Arial, sans-serif;font-size:14px;background-color:rgb(255,255,255);"">Based on fifteen years of original research Acemoglu and Robinson marshall extraordinary historical evidence from the Roman Empire, the Mayan city-states, medieval Venice, the Soviet Union, Latin America, England, Europe, the United States, and Africa to build a new theory of political economy with great relevance for the big questions of today, including: </span><br style=""color:rgb(51,51,51);font-family:Arial, sans-serif;font-size:14px;background-color:rgb(255,255,255);"" /><br style=""color:rgb(51,51,51);font-family:Arial, sans-serif;font-size:14px;background-color:rgb(255,255,255);"" /><span style=""color:rgb(51,51,51);font-family:Arial, sans-serif;font-size:14px;background-color:rgb(255,255,255);"">- China has built an authoritarian growth machine. Will it continue to grow at such high speed and overwhelm the West? </span><br style=""color:rgb(51,51,51);font-family:Arial, sans-serif;font-size:14px;background-color:rgb(255,255,255);"" /><br style=""color:rgb(51,51,51);font-family:Arial, sans-serif;font-size:14px;background-color:rgb(255,255,255);"" /><span style=""color:rgb(51,51,51);font-family:Arial, sans-serif;font-size:14px;background-color:rgb(255,255,255);"">- Are America’s best days behind it? Are we moving from a virtuous circle in which efforts by elites to aggrandize power are resisted to a vicious one that enriches and empowers a small minority? </span><br style=""color:rgb(51,51,51);font-family:Arial, sans-serif;font-size:14px;background-color:rgb(255,255,255);"" /><br style=""color:rgb(51,51,51);font-family:Arial, sans-serif;font-size:14px;background-color:rgb(255,255,255);"" /><span style=""color:rgb(51,51,51);font-family:Arial, sans-serif;font-size:14px;background-color:rgb(255,255,255);"">- What is the most effective way to help move billions of people from the rut of poverty to prosperity? More philanthropy from the wealthy nations of the West? Or learning the hard-won lessons of Acemoglu and Robinson’s breakthrough ideas on the interplay between inclusive political and economic institutions? </span>",,,en,"nations, why nations fail, poverty prosperity, economics, history, power","nations, why nations fail, poverty prosperity, economics, history",,,archive.org,WhyNationsFailTheOriginsODaronAcemoglu,0,7047640,https://archive.org/download/WhyNationsFailTheOriginsODaronAcemoglu/Why-Nations-Fail_-The-Origins-o-Daron-Acemoglu.pdf,https://archive.org/download/WhyNationsFailTheOriginsODaronAcemoglu/__ia_thumb.jpg,,,2025-11-26T03:13:07.663714
Whos Who Of Indian Writers,Sahitya Akademi New Delhi,"<p><b>Book Source:</b> <a href=""http://www.new.dli.ernet.in/handle/2015/278465"" rel=""ugc nofollow"">Digital Library of India Item 2015.278465</a></p><p>dc.date.accessioned: 2015-08-04T15:39:08Z<br />dc.date.available: 2015-08-04T15:39:08Z<br />dc.identifier.barcode: 05990010898584<br />dc.identifier.origpath: /data58/upload/0100/301<br />dc.identifier.copyno: 1<br />dc.identifier.uri: http://www.new.dli.ernet.in/handle/2015/278465<br />dc.description.scannerno: 20003530<br />dc.description.scanningcentre: IIIT, Allahabad<br />dc.description.main: 1<br />dc.description.tagged: 0<br />dc.description.totalpages: 446<br />dc.format.mimetype: application/pdf<br />dc.language.iso: English<br />dc.publisher.digitalrepublisher: Digital Library Of India<br />dc.publisher: Sahitya Akademi New Delhi<br />dc.rights: In Public Domain<br />dc.source.library: Indian Institute Of Public Administration New Delhi<br />dc.title: Whos Who Of Indian Writers<br />dc.type: ptiff<br />dc.type: pdf<br /></p>",,,en,IIIT,IIIT,,,archive.org,in.ernet.dli.2015.278465,0,48277835,https://archive.org/download/in.ernet.dli.2015.278465/2015.278465.Whos-Who.pdf,https://archive.org/download/in.ernet.dli.2015.278465/__ia_thumb.jpg,,,2025-11-26T03:13:08.670848
Amiga Computing 1-117 (June 88-Oct 97),,Amiga Computing. A magazine dedicated to the Amiga computer.,,,en,"Amiga Computing, Amiga, Magazine","Amiga Computing, Amiga, Magazine",,,archive.org,AmigaComputing056Jan93,0,38518151,https://archive.org/download/AmigaComputing056Jan93/AmigaComputing/AmigaComputing001-Jun88.pdf,https://archive.org/download/AmigaComputing056Jan93/__ia_thumb.jpg,,,2025-11-26T03:13:10.831140
The Kite Runner PDF,,"<p class=""litNoteText"" style=""font-family:latoregular, Helvetica, Arial, sans-serif;margin:0px 0px;padding:0px;font-size:16px;background-color:rgb(255,255,255);""><i style=""line-height:inherit;"">The Kite Runner</i> is the story of Amir, a Sunni Muslim, who struggles to find his place in the world because of the aftereffects and fallout from a series of traumatic childhood events. An adult Amir opens the novel in the present-day United States with a vague reference to one of these events, and then the novel flashes back to Amir's childhood in Afghanistan. In addition to typical childhood experiences, Amir struggles with forging a closer relationship with his father, Baba; with determining the exact nature of his relationship with Hassan, his Shi'a Muslim servant; and eventually with finding a way to atone for pre-adolescent decisions that have lasting repercussions. Along the way, readers are able to experience growing up in Afghanistan in a single-parent home, a situation that bears remarkable similarities to many contemporary households.</p><p class=""litNoteText"" style=""font-family:latoregular, Helvetica, Arial, sans-serif;margin:0px 0px;padding:0px;font-size:16px;background-color:rgb(255,255,255);"">One of the biggest struggles for Amir is learning to navigate the complex socioeconomic culture he faces, growing up in Afghanistan as a member of the privileged class yet not feeling like a privileged member of his own family. Hassan and his father, Ali, are servants, yet at times, Amir's relationship with them is more like that of family members. And Amir's father, Baba, who does not consistently adhere to the tenets of his culture, confuses rather than clarifies things for young Amir. Many of the ruling-class elite in Afghanistan view the world as black and white, yet Amir identifies many shades of gray.</p><p class=""litNoteText"" style=""font-family:latoregular, Helvetica, Arial, sans-serif;margin:0px 0px;padding:0px;font-size:16px;background-color:rgb(255,255,255);"">In addition to the issues affecting his personal life, Amir must also contend with the instability of the Afghan political system in the 1970s. During a crucial episode, which takes place during an important kite flying tournament, Amir decides not to act — he decides not to confront bullies and aggressors when he has the chance — and this conscious choice of inaction sets off a chain reaction that leads to guilt, lies, and betrayals. Eventually, because of the changing political climate, Amir and his father are forced to flee Afghanistan. Amir views coming to America as an opportunity to leave his past behind.</p><p class=""litNoteText"" style=""font-family:latoregular, Helvetica, Arial, sans-serif;margin:0px 0px;padding:0px;font-size:16px;background-color:rgb(255,255,255);"">Although Amir and Baba toil to create a new life for themselves in the United States, the past is unable to stay buried. When it rears its ugly head, Amir is forced to return to his homeland to face the demons and decisions of his youth, with only a slim hope to make amends.</p><p class=""litNoteText"" style=""font-family:latoregular, Helvetica, Arial, sans-serif;margin:0px 0px;padding:0px;font-size:16px;background-color:rgb(255,255,255);"">Ultimately, <i style=""line-height:inherit;"">The Kite Runner</i> is a novel about relationships — specifically the relationships between Amir and Hassan, Baba, Rahim Khan, Soraya, and Sohrab — and how the complex relationships in our lives overlap and connect to make us the people we are.</p>",,,en,"amazing, mind blowing, depressing","amazing, mind blowing, depressing",,,archive.org,TheKiteRunnerPDF_201905,0,1408771,https://archive.org/download/TheKiteRunnerPDF_201905/The-Kite-Runner-PDF.pdf,https://archive.org/download/TheKiteRunnerPDF_201905/__ia_thumb.jpg,,,2025-11-26T03:13:11.671402
The Indian Year Book 1945-46 Vol.xxxii,Not Available,"<p><b>Book Source:</b> <a href=""http://www.new.dli.ernet.in/handle/2015/59601"" rel=""ugc nofollow"">Digital Library of India Item 2015.59601</a></p><p>dc.contributor.author: Not Available<br />dc.date.accessioned: 2015-06-29T20:03:47Z<br />dc.date.available: 2015-06-29T20:03:47Z<br />dc.date.copyrightexpirydate: 0000-00-00<br />dc.date.digitalpublicationdate: 2010-04-00<br />dc.identifier.barcode: 99999990271180<br />dc.identifier.origpath: /data6/upload/0123/982<br />dc.identifier.copyno: 1<br />dc.identifier.uri: http://www.new.dli.ernet.in/handle/2015/59601<br />dc.description.scanningcentre: Banasthali University<br />dc.description.main: 1<br />dc.description.tagged: 0<br />dc.description.totalpages: 1553<br />dc.format.mimetype: application/pdf<br />dc.language.iso: English<br />dc.publisher.digitalrepublisher: Digital Library Of India<br />dc.publisher: Xxxx<br />dc.rights: Copyright Permitted<br />dc.source.library: Central Library,university Of Rajasthan<br />dc.subject.classification: Motion Pictures --india --periodicals.<br />dc.title: The Indian Year Book 1945-46 Vol.xxxii<br /></p>",,,en,Banasthali,Banasthali,,,archive.org,in.ernet.dli.2015.59601,0,95818139,https://archive.org/download/in.ernet.dli.2015.59601/2015.59601.The-Indian-Year-Book-1945-46-Volxxxii.pdf,https://archive.org/download/in.ernet.dli.2015.59601/__ia_thumb.jpg,,,2025-11-26T03:13:12.671260
The Indian Year Book Volume. Xxxiii,"Reed, Sir Stanley","<p><b>Book Source:</b> <a href=""http://www.new.dli.ernet.in/handle/2015/61534"" rel=""nofollow"">Digital Library of India Item 2015.61534</a></p><p>dc.contributor.author: Reed, Sir Stanley<br />dc.date.accessioned: 2015-06-29T21:02:45Z<br />dc.date.available: 2015-06-29T21:02:45Z<br />dc.date.copyrightexpirydate: 0000-00-00<br />dc.date.digitalpublicationdate: 2010-04-00<br />dc.date.citation: 1947<br />dc.identifier.barcode: 99999990271430<br />dc.identifier.origpath: /data6/upload/0124/232<br />dc.identifier.copyno: 1<br />dc.identifier.uri: http://www.new.dli.ernet.in/handle/2015/61534<br />dc.description.scanningcentre: Banasthali University<br />dc.description.main: 1<br />dc.description.tagged: 0<br />dc.description.totalpages: 1534<br />dc.format.mimetype: application/pdf<br />dc.language.iso: English<br />dc.publisher.digitalrepublisher: Digital Library Of India<br />dc.publisher: Calcutta, Bennett Coleman Amp Co. Ltd<br />dc.rights: Copyright Permitted<br />dc.source.library: Central Library, University Of Rajasthan<br />dc.subject.classification: India --politics And Government --1947- --periodicals.<br />dc.title: The Indian Year Book Volume. Xxxiii<br /></p>",1947,,en,Banasthali,Banasthali,,,archive.org,in.ernet.dli.2015.61534,0,107868609,https://archive.org/download/in.ernet.dli.2015.61534/2015.61534.The-Indian-Year-Book-Volume-Xxxiii.pdf,https://archive.org/download/in.ernet.dli.2015.61534/__ia_thumb.jpg,,,2025-11-26T03:13:13.906115
Songbook Collection,,A collection of digitized songbooks<span></span>,,,en,"songbook, collection, sheet, music, sheet music","songbook, collection, sheet, music, sheet music",,,archive.org,0062AmosToriToVenusAndBack,0,82488669,https://archive.org/download/0062AmosToriToVenusAndBack/0001 - #1 Adult Contemporary Hits Of The Nineties.pdf,https://archive.org/download/0062AmosToriToVenusAndBack/__ia_thumb.jpg,,,2025-11-26T03:13:14.849229
MANGA: Berserk,Kentarou Miura," <p>Gattsu, known as the Black Swordsman, seeks sanctuary from the demonic forces that persue himself and his woman, and also vengeance against the man who branded him as an unholy sacrifice. Aided only by his titanic strength, skill and sword, Gattsu must struggle against his bleak destiny, all the while fighting with a rage that might strip him of his humanity. Berserk is a dark and brooding story of outrageous swordplay and ominous fate, in the theme of Shakespeare's MacBeth.</p>  ",,,en,"Action;
Horror;","Action;
Horror;",,,archive.org,manga_Berserk,0,36873006,https://archive.org/download/manga_Berserk/!Berserk [danke-Empire]{HD}/Berserk v01 (2003) (Digital) (danke-Empire).pdf,https://archive.org/download/manga_Berserk/__ia_thumb.jpg,,,2025-11-26T03:13:15.778226
The Da Vinci Code,Dan Brown,Dan Brown's bestseller ,,,en,"dan Brown, Dan, Brown","dan Brown, Dan, Brown",,,archive.org,TheDaVinciCode_201308,0,1456358,https://archive.org/download/TheDaVinciCode_201308/The Da Vinci Code.pdf,https://archive.org/download/TheDaVinciCode_201308/__ia_thumb.jpg,,,2025-11-26T03:13:16.678447
The Gulag Archipelago in three volumes,Aleksandr Solzhenitsyn,"Unabridged original pdf scans - volume 1 (I-II) 671 pages; volume 2 (III-IV) 717 pages; volume 3 (V-VII) 579 pages. <br /><br />The Gulag Archipelago is Solzhenitsyn's masterwork, a vast canvas of camps, prisons, transit centres and secret police, of informers and spies and interrogators and also of heroism, a Stalinist anti-world at the heart of the Soviet Union where the key to survival lay not in hope but in despair. The work is based on the testimony of some two hundred survivors, and on the recollection of Solzhenitsyn's own eleven years in labour camps and exile. It is both a thoroughly researched document and a feat of literary and imaginative power.<br /><br />The three-volume book is a narrative relying on eyewitness testimony and primary research material, as well as the author's own experiences as a prisoner in a gulag labor camp. Written between 1958 and 1968, it was published in the West in 1973, thereafter circulating in samizdat (underground publication) form in the Soviet Union until its official publication in 1989.<br /><br />Structurally, the text is made up of seven sections divided (in most printed editions) into three volumes: parts 1–2, parts 3–4, and parts 5–7. At one level, the Gulag Archipelago traces the history of the system of forced labour camps that existed in the Soviet Union from 1918 to 1956, starting with V.I. Lenin's original decrees shortly after the October Revolution establishing the legal and practical framework for a series of camps where political prisoners and ordinary criminals would be sentenced to forced labour. It describes and discusses the waves of purges, assembling the show trials in context of the development of the greater Gulag system with particular attention to the legal and bureaucratic development.<br /><br />The legal and historical narrative ends in 1956, the time of Nikita Khrushchev's Secret Speech at the 20th Party Congress of 1956 denouncing Stalin's personality cult, his autocratic power, and the surveillance that pervaded the Stalin era.",1973,,en,"Gulag, Socialism, Marxism, Leninism, Communism, Stalinism, Soviet Union, Russian, counterrevolutionary, extermination camps, imprisonment, Communist Party, purges, prisoners, oppression, repression, genocide, mass murder, Siberia","Gulag, Socialism, Marxism, Leninism, Communism",,,archive.org,TheGulagArchipelago-Threevolumes,0,14948776,https://archive.org/download/TheGulagArchipelago-Threevolumes/The-Gulag-Archipelago__vol1__I-II__Solzhenitsyn.pdf,https://archive.org/download/TheGulagArchipelago-Threevolumes/__ia_thumb.jpg,,,2025-11-26T03:13:17.694132
NOVEL: Overlord,,NOVEL: Overlord,,,en,,,,,archive.org,manga_Overlord,0,5383737,https://archive.org/download/manga_Overlord/!Dark PDF/Overlord - Volume 01 - The Undead King [L1][Nigel][Psychic Kitten][Dark].pdf,https://archive.org/download/manga_Overlord/__ia_thumb.jpg,,,2025-11-26T03:13:18.894682
The New Nude Photo Magazine Premiere Issue,,The New Nude Photo Magazine Premiere Issue,,,en,"nude, hegre, petter, luba, kern, summer, carre, thenewnude, photography, erotic, nude summer, petter hegre, thenewnude summer, richard kern, clifford thurlow, didier carre, window light, von unwerth, red bikini, norbert guthier","nude, hegre, petter, luba, kern",,,archive.org,The_New_Nude_Photo_Magazine_Premiere_Issue,0,209426524,https://archive.org/download/The_New_Nude_Photo_Magazine_Premiere_Issue/The_New_Nude_Photo_Magazine_Premiere_Issue.pdf,https://archive.org/download/The_New_Nude_Photo_Magazine_Premiere_Issue/__ia_thumb.jpg,,,2025-11-26T03:13:19.685676
"Synonyms and antonyms; an alphabetical list of words in common use, grouped with others of similar and opposite meaning","Ordway, Edith B. (Edith Bertha), b. 1877","vii, 292 p. 19 cm",1913,New York : Georg Sully and co.,en,English language -- Synonyms and antonyms,English language -- Synonyms and antonyms,,,archive.org,synonymsantonyms00ordwiala,0,25687604,https://archive.org/download/synonymsantonyms00ordwiala/synonymsantonyms00ordwiala.pdf,https://archive.org/download/synonymsantonyms00ordwiala/__ia_thumb.jpg,,,2025-11-26T03:13:20.921194
The Secret Garden,"Burnett, Frances Hodgson","The story of Mary, a young child who is sent to live with her shut-in uncle who holds the key to a secret that he has kept locked away for years. <br />
Suggested Reading Level: UP (Upper Primary)",,,en,"LIT, Orphans--Fiction, Yorkshire (England)--Juvenile fiction, Gardens--Fiction, LIT.UP, People with disabilities--Fiction, C3, Chapter Books (Long)","LIT, Orphans--Fiction, Yorkshire (England)--Juvenile fiction, Gardens--Fiction, LIT.UP",,,archive.org,TheSecretGarden_201303,0,17176358,https://archive.org/download/TheSecretGarden_201303/The Secret Garden.pdf,https://archive.org/download/TheSecretGarden_201303/__ia_thumb.jpg,,,2025-11-26T03:13:21.714696
The New Psycho Cybernetics By Maxwell Maltz ( 1),,audio psycho cybernetics<br />,,,en,"self help, Maltz","self help, Maltz",,,archive.org,TheNewPsychoCyberneticsByMaxwellMaltz1,0,5148023,https://archive.org/download/TheNewPsychoCyberneticsByMaxwellMaltz1/The New Psycho-Cybernetics by Maxwell Maltz  (1).pdf,https://archive.org/download/TheNewPsychoCyberneticsByMaxwellMaltz1/__ia_thumb.jpg,,,2025-11-26T03:13:22.933176
Geronimo Stilton Books,,So much Books,,,en,Read it,Read it,,,archive.org,time-warp_202011,0,6796502,https://archive.org/download/time-warp_202011/A Christmas Tale.pdf,https://archive.org/download/time-warp_202011/__ia_thumb.jpg,,,2025-11-26T03:13:23.787225
