title,author,description,date,publisher,language,subjects,categories,isbn,pages,source,identifier,download_count,file_size,pdf_url,cover_url,local_pdf_path,local_cover_path,added_date
Cantorion sheet music collection,,A large collection of sheet music from http://cantorion.org,,,en,"sheet music, sheet music","sheet music, sheet music",,,archive.org,Cantorion_sheet_music_collection,0,74791,https://archive.org/download/Cantorion_sheet_music_collection/0039b7927e840c0dc9bdd7a89938d472.pdf,https://archive.org/download/Cantorion_sheet_music_collection/__ia_thumb.jpg,,,2025-11-26T03:10:31.960151
Atomic Habits ( PDFDrive ),,book<div><br /></div>,,,en,book,book,,,archive.org,atomic-habits-pdfdrive,0,5111325,https://archive.org/download/atomic-habits-pdfdrive/Atomic habits ( PDFDrive ).pdf,https://archive.org/download/atomic-habits-pdfdrive/__ia_thumb.jpg,,,2025-11-26T03:10:32.050187
Surah-al-waqiah,,Surah-al-waqiah,,,en,Surah-al-waqiah,Surah-al-waqiah,,,archive.org,Surah-al-waqiah,0,613725,https://archive.org/download/Surah-al-waqiah/mafiadoc.com_surah-al-waqiah-pdf-alkalampk_59fd6cec1723dd41187607ee.pdf,https://archive.org/download/Surah-al-waqiah/__ia_thumb.jpg,,,2025-11-26T03:10:32.134156
Lundy Why Does He Do That,,Are you in abusive relationship ? This book may be just what you need to finally get some answers,,,en,Relationship abuse,Relationship abuse,,,archive.org,LundyWhyDoesHeDoThat,0,6408280,https://archive.org/download/LundyWhyDoesHeDoThat/Lundy_Why-does-he-do-that.pdf,https://archive.org/download/LundyWhyDoesHeDoThat/__ia_thumb.jpg,,,2025-11-26T03:10:32.215729
Haunting Adeline,H.D Carlton,"<span style=""color:rgb(32,33,36);font-family:'Google Sans', arial, sans-serif;font-size:20px;background-color:rgb(255,255,255);"">Haunting Adeline is </span><span style=""background-color:rgba(80,151,255,0.18);color:rgb(4,12,40);font-family:'Google Sans', arial, sans-serif;font-size:20px;"">the story of Addie, an author who lives alone in the haunted manor that she inherited from her grandmother</span><span style=""color:rgb(32,33,36);font-family:'Google Sans', arial, sans-serif;font-size:20px;background-color:rgb(255,255,255);"">. Shortly after moving in, she discovers a dark secret; her great-grandmother was murdered in that house and the killer was never caught. While trying to uncover her grandmother's mystery, she falls, quite literally, in the same situation.</span>",2021-07-12,,en,"Stalker, murder, love, dark romance","Stalker, murder, love, dark romance",,,archive.org,haunting-adeline,0,4429225,https://archive.org/download/haunting-adeline/Haunting Adeline.pdf,https://archive.org/download/haunting-adeline/__ia_thumb.jpg,,,2025-11-26T03:10:32.296518
"The Complete Book Of Enoch, Standard English Version Jay Winter",,The Book of Enoch,,,en,"Enoch, Nephelim","Enoch, Nephelim",,,archive.org,TheCompleteBookOfEnochStandardEnglishVersionJayWinter,0,2952283,"https://archive.org/download/TheCompleteBookOfEnochStandardEnglishVersionJayWinter/The Complete Book of Enoch, Standard English Version - Jay Winter.pdf",https://archive.org/download/TheCompleteBookOfEnochStandardEnglishVersionJayWinter/__ia_thumb.jpg,,,2025-11-26T03:10:32.380992
Cantorion sheet music collection (part 3),,,,,en,sheet music,sheet music,,,archive.org,Cantorion_sheet_music_collection_3,0,3231046,https://archive.org/download/Cantorion_sheet_music_collection_3/00152640266732a1a1c4473b75d2085c.pdf,https://archive.org/download/Cantorion_sheet_music_collection_3/__ia_thumb.jpg,,,2025-11-26T03:10:34.304986
Goody Two-Shoes,,"[""Publisher's chromolithographed pictorial wrappers"", 'Ex libris Elvah Karshner']",c1888,New-York : McLoughlin Bro's,en,"Brothers and sisters, Orphans, Conduct of life, Education","Brothers and sisters, Orphans, Conduct of life, Education",,,archive.org,goodytwoshoes00newyiala,0,1508606,https://archive.org/download/goodytwoshoes00newyiala/goodytwoshoes00newyiala.pdf,https://archive.org/download/goodytwoshoes00newyiala/__ia_thumb.jpg,,,2025-11-26T03:10:34.401145
Essential Grammar In Use 4th Edition By R. Murphy,,Essential Grammar In Use ..,,,en,Gramatica pow,Gramatica pow,,,archive.org,EssentialGrammarInUse4thEditionByR.Murphy,0,14091812,https://archive.org/download/EssentialGrammarInUse4thEditionByR.Murphy/Essential Grammar in Use 4th Edition by R. Murphy.pdf,https://archive.org/download/EssentialGrammarInUse4thEditionByR.Murphy/__ia_thumb.jpg,,,2025-11-26T03:10:34.482626
the-art-of-seduction-robert-greene,"Robert Greene, author of The 48 Laws of Power, has a degree in classical literature. He lives in Los Angeles. Visit his Web site: www.seductionbook.com Joost Elffers is the producer of Viking Studio's best- selling The Secret Language of Birthdays, The Secret Language of Relationships, as well as Play with Your Food. He lives in New York City","<div class=""thumb tright"" style=""clear:right;float:right;margin:0.5em 0px 1.3em 1.4em;width:auto;background-color:rgb(255,255,255);color:rgb(34,34,34);font-family:sans-serif;font-size:14px;""><div class=""thumbinner"" style=""border:1px solid rgb(200,204,209);padding:3px;background-color:rgb(248,249,250);font-size:13.16px;text-align:center;width:222px;""><a href=""https://en.wikipedia.org/wiki/File:Max_Slevogt_Francisco_d%27Andrade_as_Don_Giovanni.jpg"" class=""image"" style=""color:rgb(11,0,128);background:none;"" rel=""ugc nofollow""><img alt="""" src=""//web.archive.org/web/2im_/https://upload.wikimedia.org/wikipedia/commons/thumb/9/97/Max_Slevogt_Francisco_d%27Andrade_as_Don_Giovanni.jpg/220px-Max_Slevogt_Francisco_d%27Andrade_as_Don_Giovanni.jpg"" width=""220"" height=""269"" class=""thumbimage"" style=""border:1px solid rgb(200,204,209);vertical-align:middle;background-color:rgb(255,255,255);"" /></a><div class=""thumbcaption"" style=""border:0px;line-height:1.4em;padding:3px;font-size:12.3704px;text-align:left;""><div class=""magnify"" style=""float:right;margin-left:3px;margin-right:0px;""><a href=""https://en.wikipedia.org/wiki/File:Max_Slevogt_Francisco_d%27Andrade_as_Don_Giovanni.jpg"" class=""internal"" title=""Enlarge"" style=""color:rgb(11,0,128);background:0;text-indent:15px;white-space:nowrap;width:15px;height:11px;"" rel=""ugc nofollow""></a></div>Don Juan in <a href=""https://en.wikipedia.org/wiki/Mozart"" class=""mw-redirect"" title=""Mozart"" style=""color:rgb(11,0,128);background:none;"" rel=""ugc nofollow"">Mozart's</a> opera <i><a href=""https://en.wikipedia.org/wiki/Don_Giovanni"" title=""Don Giovanni"" style=""color:rgb(11,0,128);background:none;"" rel=""ugc nofollow"">Don Giovanni</a></i>, a painting by <a href=""https://en.wikipedia.org/wiki/Max_Slevogt"" title=""Max Slevogt"" style=""color:rgb(11,0,128);background:none;"" rel=""ugc nofollow"">Max Slevogt</a></div></div></div><p style=""margin:0.5em 0px;line-height:inherit;color:rgb(34,34,34);font-family:sans-serif;background-color:rgb(255,255,255);""><span style=""font-size:14px;""><b>Seduction</b> is the process of deliberately <a href=""https://en.wiktionary.org/wiki/entice"" class=""extiw"" title=""wikt:entice"" style=""color:rgb(102,51,102);background:none;"" rel=""ugc nofollow"">enticing</a> a person, to engage in a relationship, to lead astray, as from duty, rectitude, or the like; to <a href=""https://en.wikipedia.org/wiki/Corruption"" title=""Corruption"" style=""color:rgb(11,0,128);background:none;"" rel=""ugc nofollow"">corrupt</a>, to <a href=""https://en.wikipedia.org/wiki/Persuade"" class=""mw-redirect"" title=""Persuade"" style=""color:rgb(11,0,128);background:none;"" rel=""ugc nofollow"">persuade</a> or <a href=""https://en.wiktionary.org/wiki/induce"" class=""extiw"" title=""wikt:induce"" style=""color:rgb(102,51,102);background:none;"" rel=""ugc nofollow"">induce</a> to engage in <a href=""https://en.wikipedia.org/wiki/Human_sexual_activity"" title=""Human sexual activity"" style=""color:rgb(11,0,128);background:none;"" rel=""ugc nofollow"">sexual behaviour</a>. Strategies of seduction include conversation and sexual scripts, paralingual features, <a href=""https://en.wikipedia.org/wiki/Non-verbal_communication"" class=""mw-redirect"" title=""Non-verbal communication"" style=""color:rgb(11,0,128);background:none;"" rel=""ugc nofollow"">non-verbal communication</a>, and short-term behavioural strategies. The word <i>seduction</i> stems from <a href=""https://en.wikipedia.org/wiki/Latin"" title=""Latin"" style=""color:rgb(11,0,128);background:none;"" rel=""ugc nofollow"">Latin</a> and means literally ""leading astray.</span><span style=""font-size:11.2px;white-space:nowrap;"">2</span><span style=""font-size:14px;"">As a result, the term may have a positive or negative connotation. Famous seducers from history or legend include </span><a href=""https://en.wikipedia.org/wiki/Lilith"" title=""Lilith"" style=""font-size:14px;color:rgb(11,0,128);background:none;"" rel=""ugc nofollow"">Lilith</a><span style=""font-size:14px;"">, </span><a href=""https://en.wikipedia.org/wiki/Giacomo_Casanova"" title=""Giacomo Casanova"" style=""font-size:14px;color:rgb(11,0,128);background:none;"" rel=""ugc nofollow"">Giacomo Casanova</a><span style=""font-size:14px;"">, and the fictional character </span><a href=""https://en.wikipedia.org/wiki/Don_Juan"" title=""Don Juan"" style=""font-size:14px;color:rgb(11,0,128);background:none;"" rel=""ugc nofollow"">Don Juan</a><span style=""font-size:14px;"">. The emergence of the Internet and technology has supported the availability and the existence of a </span><a href=""https://en.wikipedia.org/wiki/Seduction_community"" class=""mw-redirect"" title=""Seduction community"" style=""font-size:14px;color:rgb(11,0,128);background:none;"" rel=""ugc nofollow"">seduction community</a><span style=""font-size:14px;"">, which is based on discourse about seduction. This is predominately by </span><a href=""https://en.wikipedia.org/wiki/Pickup_artist"" title=""Pickup artist"" style=""font-size:14px;color:rgb(11,0,128);background:none;"" rel=""ugc nofollow"">""pickup artists"" (PUA)</a><span style=""font-size:14px;"">. Seduction is also used within marketing to increase compliance and willingness.</span><sup class=""reference"" style=""font-size:11.2px;line-height:1;white-space:nowrap;""><a href=""https://en.wikipedia.org/wiki/Seduction#cite_note-:3-7"" style=""color:rgb(11,0,128);background:none;"" rel=""ugc nofollow"">[7]</a></sup></p><p style=""margin:0.5em 0px;line-height:inherit;color:rgb(34,34,34);font-family:sans-serif;font-size:14px;background-color:rgb(255,255,255);"">Seduction, seen negatively, involves <a href=""https://en.wikipedia.org/wiki/Temptation"" title=""Temptation"" style=""color:rgb(11,0,128);background:none;"" rel=""ugc nofollow"">temptation</a> and <a href=""https://en.wikipedia.org/wiki/Enticement"" title=""Enticement"" style=""color:rgb(11,0,128);background:none;"" rel=""ugc nofollow"">enticement</a>, often sexual in nature, to lead someone astray into a behavioural choice they would not have made if they were not in a state of <a href=""https://en.wikipedia.org/wiki/Sexual_arousal"" title=""Sexual arousal"" style=""color:rgb(11,0,128);background:none;"" rel=""ugc nofollow"">sexual arousal</a>. Seen positively, seduction is a synonym for the act of charming someone—male or female—by an appeal to the senses, often with the goal of reducing unfounded fears and leading to their ""sexual emancipation."" Some sides in contemporary academic debate state that the morality of seduction depends on the long-term impacts on the individuals concerned, rather than the act itself, and may not necessarily carry the negative connotations expressed in dictionary definitions.</p>",2009-11-22,,en,the- art- of - seduction,the- art- of - seduction,,,archive.org,the-art-of-seduction-robert-greene,0,4844385,https://archive.org/download/the-art-of-seduction-robert-greene/the-art-of-seduction-robert-greene.pdf,https://archive.org/download/the-art-of-seduction-robert-greene/__ia_thumb.jpg,,,2025-11-26T03:10:34.570456
The Apothecary Diaries Light Novels ( volumes 1-15),Natsu Hyūga,"This is the translated Apothecary Diaries Light Novel series provided by yours truly!<div><br /></div><div><br /></div><div>Enjoy!</div><div><br /></div><div>I'm no sure about the page issue, sorry! I hope you've all figured it out by now?</div><div><br /></div><div>Please be wary of slow updates, I’m human with a life and a job too.</div>",2014,,en,"Apothecary Diaries, Light Novel","Apothecary Diaries, Light Novel",,,archive.org,the-apothecary-diaries-light-novel-series,0,15958197,https://archive.org/download/the-apothecary-diaries-light-novel-series/The Apothecary Diaries Volume 14.pdf,https://archive.org/download/the-apothecary-diaries-light-novel-series/Screenshot 2024-02-07 at 8.29.32 PM_thumb.jpg,,,2025-11-26T03:10:34.668784
The Crucible Full Text,,<p>Miller's Play</p>,,,en,"witch craft, religion, play","witch craft, religion, play",,,archive.org,TheCrucibleFullText,0,524252,https://archive.org/download/TheCrucibleFullText/The Crucible full text.pdf,https://archive.org/download/TheCrucibleFullText/__ia_thumb.jpg,,,2025-11-26T03:10:34.785964
Cantorion sheet music collection (part 2),,A collection of public domain sheet music from http://cantorion.org,,,en,"sheet music, sheet music","sheet music, sheet music",,,archive.org,Cantorion_sheet_music_collection_2,0,295052,https://archive.org/download/Cantorion_sheet_music_collection_2/000c62eff18e9d38179265bc831b9931.pdf,https://archive.org/download/Cantorion_sheet_music_collection_2/__ia_thumb.jpg,,,2025-11-26T03:10:34.954388
Diary Of A Wimpy Kid Book Series,Jeff Kinney,"Journals of the main character, Greg Heffley. Befitting a teen's diary, the books are filled with hand-written notes and simple drawings of Greg's daily adventures.",2007-04-01,,en,"Comedy, Young Adult Fiction","Comedy, Young Adult Fiction",,,archive.org,diaryofawimpykidbookseriesbyjeffkinney_202004,0,8260083,https://archive.org/download/diaryofawimpykidbookseriesbyjeffkinney_202004/Diary of a wimpy kid book01.pdf,https://archive.org/download/diaryofawimpykidbookseriesbyjeffkinney_202004/__ia_thumb.jpg,,,2025-11-26T03:10:35.040853
The Voynich Manuscript,,"The Voynich Manuscript is a document that is notable for its strange text, that to date hasn't been decyphered. Theories range from a secret language or code to an old sort of joke or hoax.",,,en,voynich; manuscript,voynich; manuscript,,,archive.org,TheVoynichManuscript,0,56222755,https://archive.org/download/TheVoynichManuscript/Voynich_Manuscript.pdf,https://archive.org/download/TheVoynichManuscript/__ia_thumb.jpg,,,2025-11-26T03:10:36.729169
Particulate Filtering Facepiece Respirator User Instructions,,"Particulate Filtering Facepiece Respirator User Instructions for N100, N95, N99, P100, P95, P99, and R95",,,en,N100; N95; N99; P100; P95; P99; R95; Donning; Doffing; Particulate; Filtering; Facepiece; Respirator; User Instructions,N100; N95; N99; P100; P95; P99; R95; Donning; Doffing; Particulate; Filtering; Facepiece; Respirator; User Instructions,,,archive.org,ParticulateFilteringFacepieceRespiratorUserInstructions,0,264114,https://archive.org/download/ParticulateFilteringFacepieceRespiratorUserInstructions/0006-3M-1860-1860S.pdf,https://archive.org/download/ParticulateFilteringFacepieceRespiratorUserInstructions/__ia_thumb.jpg,,,2025-11-26T03:10:37.972770
The Way Of The Superior Man.pdf (PDFy mirror),,"<p>	<strong>This public document was automatically mirrored from <a href=""https://pdf.yt/"" rel=""ugc nofollow"">PDFy</a>.</strong></p><ul><li><strong>Original filename:</strong> The Way Of The Superior Man.pdf</li>	<li><strong>URL:</strong> <a href=""http://pdf.yt/d/TIGwEuUmNnQVm7x7"" rel=""ugc nofollow"">https://pdf.yt/d/TIGwEuUmNnQVm7x7</a></li>	<li><strong>Upload date:</strong> July 15, 2014 12:43:42</li></ul>",2014-01-01,,en,"mirror, pdf.yt","mirror, pdf.yt",,,archive.org,pdfy-TIGwEuUmNnQVm7x7,0,1292081,https://archive.org/download/pdfy-TIGwEuUmNnQVm7x7/The Way Of The Superior Man.pdf,https://archive.org/download/pdfy-TIGwEuUmNnQVm7x7/__ia_thumb.jpg,,,2025-11-26T03:10:38.676611
IA Law Enforcement Requests,,IA Law Enforcement Requests<br />,2016-11-21,,en,"IA Law Enforcement Requests, internet archive","IA Law Enforcement Requests, internet archive",,,archive.org,ialerequestsummary,0,305665,https://archive.org/download/ialerequestsummary/transparency-LERequestSummary2013.pdf,https://archive.org/download/ialerequestsummary/__ia_thumb.jpg,,,2025-11-26T03:10:39.890432
Barely Legal Magazine,Hustler,"<table class=""infobox hproduct cke_show_border"" style=""border:1px solid rgb(162,169,177);font-size:12.319999694824219px;border-spacing:3px;background-color:rgb(248,249,250);margin:0.5em 0px 0.5em 1em;padding:0.2em;clear:right;line-height:1.5em;font-family:sans-serif;width:22em;""><caption class=""fn"" style=""font-size:15.399999618530273px;font-weight:bold;padding:0.2em;""><i>Barely Legal</i></caption><tbody><tr><td colspan=""2"" style=""border:1px dotted rgb(211,211,211);vertical-align:top;text-align:center;""><a class=""image"" href=""https://en.wikipedia.org/wiki/File:Barelylegal.jpg"" style=""text-decoration:none;color:rgb(11,0,128);background-image:none;"" rel=""ugc nofollow""><img alt=""Barely Legal Magazine"" src=""//web.archive.org/web/2im_/https://dl.dropboxusercontent.com/u/200015521/Pictures/Barely%20Legal%20Magazine.jpg"" style=""border:none;vertical-align:middle;width:145px;height:195px;"" /></a></td></tr><tr><th style=""border:1px dotted rgb(211,211,211);vertical-align:top;"">Editor</th><td style=""border:1px dotted rgb(211,211,211);vertical-align:top;""><a href=""https://en.wikipedia.org/wiki/Larry_Flynt"" title=""Larry Flynt"" style=""text-decoration:none;color:rgb(11,0,128);background-image:none;"" rel=""ugc nofollow"">Larry Flynt</a></td></tr><tr><th style=""border:1px dotted rgb(211,211,211);vertical-align:top;"">Categories</th><td style=""border:1px dotted rgb(211,211,211);vertical-align:top;""><a href=""https://en.wikipedia.org/wiki/Pornographic_magazine"" title=""Pornographic magazine"" style=""text-decoration:none;color:rgb(11,0,128);background-image:none;"" rel=""ugc nofollow"">Pornographic men's</a></td></tr><tr><th style=""border:1px dotted rgb(211,211,211);vertical-align:top;"">Frequency</th><td style=""border:1px dotted rgb(211,211,211);vertical-align:top;"">13 / year</td></tr><tr><th style=""border:1px dotted rgb(211,211,211);vertical-align:top;""><a href=""https://en.wikipedia.org/wiki/List_of_magazines_by_circulation"" title=""List of magazines by circulation"" style=""text-decoration:none;color:rgb(11,0,128);background-image:none;"" rel=""ugc nofollow"">Circulation</a></th><td style=""border:1px dotted rgb(211,211,211);vertical-align:top;"">under 500,000</td></tr><tr><th style=""border:1px dotted rgb(211,211,211);vertical-align:top;"">First issue</th><td style=""border:1px dotted rgb(211,211,211);vertical-align:top;"">September 1993<sup class=""reference"" style=""line-height:1;white-space:nowrap;font-size:9.855999946594238px;""><a href=""https://en.wikipedia.org/wiki/Barely_Legal_(magazine)#cite_note-First_Issue-1"" style=""text-decoration:none;color:rgb(11,0,128);background-image:none;"" rel=""ugc nofollow"">[1]</a></sup><sup class=""reference"" style=""line-height:1;white-space:nowrap;font-size:9.855999946594238px;""><a href=""https://en.wikipedia.org/wiki/Barely_Legal_(magazine)#cite_note-1st_Issue-2"" style=""text-decoration:none;color:rgb(11,0,128);background-image:none;"" rel=""ugc nofollow"">[2]</a></sup></td></tr><tr><th style=""border:1px dotted rgb(211,211,211);vertical-align:top;"">Company</th><td style=""border:1px dotted rgb(211,211,211);vertical-align:top;""><a href=""https://en.wikipedia.org/wiki/Larry_Flynt_Publications"" title=""Larry Flynt Publications"" style=""text-decoration:none;color:rgb(11,0,128);background-image:none;"" rel=""ugc nofollow"">Larry Flynt Publications</a></td></tr><tr><th style=""border:1px dotted rgb(211,211,211);vertical-align:top;"">Country</th><td style=""border:1px dotted rgb(211,211,211);vertical-align:top;"">US</td></tr><tr><th style=""border:1px dotted rgb(211,211,211);vertical-align:top;"">Based in</th><td style=""border:1px dotted rgb(211,211,211);vertical-align:top;"">Los Angeles</td></tr><tr><th style=""border:1px dotted rgb(211,211,211);vertical-align:top;"">Language</th><td style=""border:1px dotted rgb(211,211,211);vertical-align:top;""><a href=""https://en.wikipedia.org/wiki/English_language"" title=""English language"" style=""text-decoration:none;color:rgb(11,0,128);background-image:none;"" rel=""ugc nofollow"">English</a></td></tr><tr><th style=""border:1px dotted rgb(211,211,211);vertical-align:top;"">Website</th><td style=""border:1px dotted rgb(211,211,211);vertical-align:top;""><a class=""external text"" href=""http://secure.barelylegal.com/track/NDM2MzI4LjEuNC40LjAuMC4wLjAuMA"" style=""text-decoration:none;color:rgb(102,51,102);padding-right:13px;background-position:100% 100%;"" rel=""ugc nofollow"">Hustler's Barely Legal website</a></td></tr><tr><th style=""border:1px dotted rgb(211,211,211);vertical-align:top;""><a href=""https://en.wikipedia.org/wiki/International_Standard_Serial_Number"" title=""International Standard Serial Number"" style=""text-decoration:none;color:rgb(11,0,128);background-image:none;"" rel=""ugc nofollow"">ISSN</a></th><td style=""border:1px dotted rgb(211,211,211);vertical-align:top;""><a class=""external text"" href=""https://www.worldcat.org/issn/0149-4635"" style=""text-decoration:none;color:rgb(102,51,102);padding-right:13px;background-position:100% 100%;"" rel=""ugc nofollow"">0149-4635</a></td></tr></tbody></table>",1993-09,,en,"Pornographic Magazine, Hustler, Barely Legal","Pornographic Magazine, Hustler, Barely Legal",,,archive.org,BarelyLegalMagazine,0,23322161,https://archive.org/download/BarelyLegalMagazine/Barely Legal - 2007 11.pdf,https://archive.org/download/BarelyLegalMagazine/00_Thumbnail - Barely Legal Magazine.jpg,,,2025-11-26T03:10:40.786886
Cantorion sheet music collection (part 4),,A collection of freely licensed sheet music.,,,en,"sheet music, sheet music","sheet music, sheet music",,,archive.org,Cantorion_sheet_music_collection_4,0,310195,https://archive.org/download/Cantorion_sheet_music_collection_4/00c085668258085b41c22070ba09b2c6.pdf,https://archive.org/download/Cantorion_sheet_music_collection_4/__ia_thumb.jpg,,,2025-11-26T03:10:41.835374
twisted_games,Ana Huang,"<i><span style=""color:rgb(32,33,36);font-family:'Google Sans', arial, sans-serif;font-size:20px;background-color:rgb(255,255,255);"">Twisted Games is the second installment in Ana Huang's </span><span style=""color:rgb(32,33,36);font-family:'Google Sans', arial, sans-serif;font-size:20px;background-color:rgb(255,255,255);""><span class=""c5aZPb""><span class=""JPfdse"" style=""border-bottom:1px dashed rgba(4,12,40,0.5);"">Twisted series</span></span></span><span style=""color:rgb(32,33,36);font-family:'Google Sans', arial, sans-serif;font-size:20px;background-color:rgb(255,255,255);"">. </span><span style=""background-color:rgb(211,227,253);color:rgb(4,12,40);font-family:'Google Sans', arial, sans-serif;font-size:20px;"">It follows the story of Bridget, a princess of Eldora who falls in love with her bodyguard</span><span style=""color:rgb(32,33,36);font-family:'Google Sans', arial, sans-serif;font-size:20px;background-color:rgb(255,255,255);"">. The book tells the tale of a forbidden and concealed romance between a future queen and her highly protective bodyguard.</span></i>",,,en,"princess, forbidden romance","princess, forbidden romance",,,archive.org,twisted_games,0,2678334,https://archive.org/download/twisted_games/twisted_games.pdf,https://archive.org/download/twisted_games/__ia_thumb.jpg,,,2025-11-26T03:10:42.681663
Harrison Bergeron (& Activity),"Vonnegut, Kurt","In a world where every person is equal, those that exhibit above-average intelligence are kept in check via loud earpieces to distract them from thinking too much. <div><br /></div><div>Suggested Level: LS (Lower Secondary)</div>",,,en,"LIT, LS, LIT.LS, Short Stories, Science Fiction, Mediocrity--Fiction, Gifted persons--Fiction, Dissenters--Fiction, Games and activities--(Secondary)","LIT, LS, LIT.LS, Short Stories, Science Fiction",,,archive.org,HarrisonBergeron,0,87235,https://archive.org/download/HarrisonBergeron/Harrison Bergeron.pdf,https://archive.org/download/HarrisonBergeron/__ia_thumb.jpg,,,2025-11-26T03:10:43.689147
THE ART OF CARICATURING,SMITH,,1941,FREDERICK J.DRAKE & CO. PUBLISHERS,en,ART,ART,,,archive.org,artofcaricaturin006061mbp,0,4256095,https://archive.org/download/artofcaricaturin006061mbp/artofcaricaturin006061mbp.pdf,https://archive.org/download/artofcaricaturin006061mbp/__ia_thumb.jpg,,,2025-11-26T03:10:45.433244
Ikigai The Japanese Secret To A Long And Happy Life ( PDFDrive.com ),Akihiro Hasegawa,Ikigai,,,en,Ikigai,Ikigai,,,archive.org,ikigai-the-japanese-secret-to-a-long-and-happy-life-pdfdrive.com,0,3633287,https://archive.org/download/ikigai-the-japanese-secret-to-a-long-and-happy-life-pdfdrive.com/Ikigai _ the Japanese secret to a long and happy life ( PDFDrive.com ).pdf,https://archive.org/download/ikigai-the-japanese-secret-to-a-long-and-happy-life-pdfdrive.com/__ia_thumb.jpg,,,2025-11-26T03:10:45.682374
